{
  "schema_version": 1,
  "implementation_commit": "728d5dce4d41423095261261e63532664b6bc537",
  "implementation_tree": "f2a1cf46436844194bcbd4dbc5b048bee0b43e66",
  "implementation_ci_run": 31945210527,
  "files": [
    {
      "path": "scripts/p8d4g-production-runner.mjs",
      "sha256": "e5aac9cf06fa195705fa92e8c1cc9be1025c3c4ea2ad18d15f6e2b38c8704580"
    },
    {
      "path": "scripts/p8d4g-production-operations.mjs",
      "sha256": "54a5d679f189494a7e0c67f7981fa16f8be098211b44932432c5e00d5ecfdee6"
    },
    {
      "path": "docs/schemas/p8d4g-result.schema.json",
      "sha256": "82889a97c3fcfb4c9cfce48f526597b8772d279b8a5cbee762c25be3af688ae8"
    },
    {
      "path": "docs/schemas/p8d4g-execution-control.schema.json",
      "sha256": "18e318aaae4b7df17e6de0988af311db7d967c98dc5fc569de1ddb8504c556d9"
    },
    {
      "path": "package.json",
      "sha256": "c7d9580e85aa3da05113e052f8ca9e3102c80e001862026b2f1a945b6c1893bf"
    }
  ]
}
